"","review","brand","variety","style","country","stars","year","top_ten"
"1219",1362,"Mamee","Instant Noodles Curry Flavour","Pack","Malaysia",3.5,"0",0
"1220",1361,"Mamee","Chef Creamy Tom Yam Flavour","Pack","Malaysia",5,"0",0
"1221",1360,"Mamee","Monster BBQ Flavour Snack Noodles","Pack","Malaysia",3.75,"0",0
"1222",1359,"Mamee","Chef Curry Laksa Flavour","Cup","Malaysia",5,"0",0
"1223",1358,"Mamee","SLLRRRP! Asam Laksa","Pack","Malaysia",4,"0",0
"1224",1357,"Mamee","Mie Goreng Indonesia Spicy Sambal","Cup","Malaysia",5,"0",0
"1225",1356,"Mamee","Chef Spicy Chicken Shiitake Flavour","Pack","Malaysia",3.25,"0",0
"1226",1355,"Mamee","Instant Vermicelli Chicken Flavour","Pack","Malaysia",3.25,"0",0
"1227",1354,"Mamee","Chef Creamy Tom Yam Flavour","Cup","Malaysia",4.75,"0",0
"1228",1353,"Mamee","Instant Noodles Vegetarian Flavour","Pack","Malaysia",3.75,"0",0
"1229",1352,"Mamee","SLLRRRP! Kari Berapi","Pack","Malaysia",3.75,"0",0
"1230",1351,"Mamee","Monster Chicken Flavour Snack Noodles","Pack","Malaysia",4,"0",0
"1231",1350,"Mamee","Chef Curry Laksa Flavour","Pack","Malaysia",5,"2014",7
"1232",1349,"Mamee","Mie Goreng Indonesia Original Flavour","Cup","Malaysia",4.5,"0",0
"1233",1348,"Mamee","Instant Vermicelli Tom Yam Flavour","Pack","Malaysia",3.75,"0",0
"1234",1347,"Paldo","Bulnak Bokkummyun Spicy Fried Octopus Ramyun","Pack","South Korea",4,"0",0
"1235",1346,"Oyatsu","Baby Star Ramen Round Consomme Mini","Pack","Japan",3.75,"0",0
"1236",1345,"Lotus Foods","Forbidden Rice Ramen","Pack","USA",2.25,"0",0
"1237",1344,"Lotus Foods","Millet & Brown Rice Ramen","Pack","USA",4,"0",0
"1238",1343,"Lotus Foods","Jade Pearl Rice Ramen","Pack","USA",3.25,"0",0
"1239",1342,"Ah Lai","White Curry Noodle","Pack","Malaysia",4.5,"0",0
"1240",1341,"Plats Du Chef","Cuisine Adventures Chicken Pho Soup","Bowl","Canada",5,"0",0
"1241",1340,"Indomie","Taste Of Asia Mi Goreng Rasa Bulgogi Ala Korea","Pack","Indonesia",2.75,"0",0
"1242",1339,"Kin-Dee","Instant Rice Noodle Pad Thai","Tray","Thailand",3.75,"0",0
"1243",1338,"Batchelors","Super Noodles Peppered Steak Flavour","Pack","UK",1.5,"0",0
"1244",1337,"Sakura Noodle","Chikara Brand Udon Beef Flavor","Pack","USA",4.25,"0",0
"1245",1336,"Shirakiku","Fresh Chow Mein Noodles With Seasoning","Pack","USA",3.75,"0",0
"1246",1335,"Sakura Noodle","Chikara Brand Udon Hot & Spicy Flavor","Pack","USA",4,"0",0
"1247",1334,"Sakura Noodle","Chikara Brand Udon Mushroom Flavor","Pack","USA",3.75,"0",0
"1248",1333,"Sakura Noodle","Chikara Brand Udon Oriental Flavor","Pack","USA",3.75,"0",0
"1249",1332,"Sakura Noodle","Chikara Brand Udon Chicken Flavor","Pack","USA",3.75,"0",0
"1250",1331,"Indomie","Taste Of Asia Mi Kuah Rasa Tom Yum Ala Thailand","Pack","Indonesia",3.75,"0",0
"1251",1330,"Sapporo Ichiban","Otafuku Okonomi Sauce Yakisoba","Tray","Japan",5,"2014",4
"1252",1329,"Vifon","Oriental Style Instant Noodle Mi Ga Chicken Flavor","Cup","Vietnam",1.25,"0",0
"1253",1328,"A-Sha Dry Noodle","Hello Kitty La Wei (Spicy Flavor)","Pack","Taiwan",3.75,"0",0
"1254",1327,"Unif","Unif-100 Instant Noodles Artificial Tart Beef Flavor","Pack","China",3,"0",0
"1255",1326,"Mamee","Mi Segera SLLRRRP! Perencah Kari Xtra Pedas","Pack","Malaysia",3.75,"0",0
"1256",1325,"Koka","Spicy Shrimp Tom Yam Flavour","Cup","Singapore",3.25,"0",0
"1257",1324,"Ruski","Instant Noodles Stewed Beef Flavour","Pack","Thailand",3.5,"0",0
"1258",1323,"Golden Wheat","Korean Style Mushroom Chicken Flavour Cooking Noodle","Pack","China",2,"0",0
"1259",1322,"Hi-Myon","Instant Noodle Udon Hot & Spicy","Pack","South Korea",4,"0",0
"1260",1321,"Takamori Kosan","Fresh Chow Mein Noodles With Seasoning","Pack","Japan",3.75,"0",0
"1261",1320,"Mama","Instant Noodles Cup Seafood Flavour","Cup","Thailand",3.75,"0",0
"1262",1319,"Adabi","Mi Segera Kari Ayam Instant Noodles","Pack","Malaysia",4.25,"0",0
"1263",1318,"Nissin","Spa Oh Tarako Spaghetti","Bowl","Japan",4,"0",0
"1264",1317,"Ve Wong","Little Prince Brand Snack Noodles Original Flavor","Pack","Taiwan",2.5,"0",0
"1265",1316,"Ottogi","Japchae Vermicelli Noodle","Pack","South Korea",2.75,"0",0
"1266",1315,"Sainsbury's","Chicken Flavour Instant Noodles","Pack","UK",2.75,"0",0
"1267",1314,"Paldo","Korean Traditional Beef Gomtangmen","Pack","South Korea",5,"0",0
"1268",1313,"Healtimie","Green Barley Noodle Vegetable Soup","Pack","Indonesia",3.25,"0",0
"1269",1312,"Maruchan","I Want To Eat Ramen Miso Flavor","Pack","Japan",3.75,"0",0
"1270",1311,"Pop Bihun","Spesial Rasa Soto Ayam","Pack","Indonesia",4,"0",0
"1271",1310,"Thai Kitchen","Rice Noodle Cart Thai Peanut","Tray","USA",3,"0",0
"1272",1309,"Yum Yum","Oriental Style Instant Noodles Seafood Flavour","Cup","Thailand",3.75,"0",0
"1273",1308,"Nongshim","Soon Veggie Noodle Soup","Pack","South Korea",5,"2014",9
"1274",1307,"Nissin","Cup Noodle Cheese Curry","Cup","Japan",3.75,"0",0
"1275",1306,"Koka","Oriental Style Instant Noodles Tom Yam Flavour","Pack","Singapore",2.5,"0",0
"1276",1305,"A-Sha Dry Noodle","Instant Noodle Original Flavor","Pack","Taiwan",3.75,"0",0
"1277",1304,"Nissin","Demae Ramen Shoyu Tonkotsu Artificial Pork Flavour","Pack","Hong Kong",4.75,"0",0
"1278",1303,"Western Family","Instant Noodles In A Cup Chicken Flavour","Cup","Canada",1.5,"0",0
"1279",1302,"Mama","Instant Noodles Yentafo Tom Yum Mohfai Flavour","Pack","Thailand",5,"2014",10
"1280",1301,"Knorr","Quick Serve Macaroni Shrimp Broth","Pack","Hong Kong",3.25,"0",0
"1281",1300,"Samyang Foods","Red Nagasaki Jjampong","Pack","South Korea",5,"0",0
"1282",1299,"Mr. Noodles","Noodles In A Cup Spicy Chicken Simulated Flavour","Cup","Canada",1,"0",0
"1283",1298,"Good Tto Leu Foods","Lightning Beef Bone Tteokguk Rice Cake Soup","Bowl","South Korea",4,"0",0
"1284",1297,"GaGa","Mie Gepeng Kuah Rasa Ayam Lada Hitam","Pack","Indonesia",3.25,"0",0
"1285",1296,"Wu-Mu","Ramen With Pickled Mustard Flavor","Pack","Taiwan",3.5,"0",0
"1286",1295,"Wu-Mu","Steam Mushroom Flavor Ramen","Pack","Taiwan",3.25,"0",0
"1287",1294,"Thai Choice","Instant Noodles Chicken Flavour","Cup","Thailand",3,"0",0
"1288",1293,"Myojo","Prawn Noodles","Pack","Singapore",4.25,"0",0
"1289",1292,"Nissin","Cup Noodles Sabor A Carne Sopa Con Fideos","Cup","Colombia",3,"0",0
"1290",1291,"A-One","M Ly Instant Noodles M Tm Shrimp Flavor","Cup","Vietnam",3.25,"0",0
"1291",1290,"Nongshim","Sain Sain Garlic Teriyaki Fresh Cooked Udon Pasta","Tray","South Korea",4.5,"0",0
"1292",1289,"JML","Braised Beef Noodles","Pack","China",4,"0",0
"1293",1288,"Sau Tao","QQ Scallop Seafood Vermicelli","Bowl","Hong Kong",3.75,"0",0
"1294",1287,"Kimura","Kumamoto Tonkotsu Ramen","Pack","Japan",5,"0",0
"1295",1286,"Batchelors","Super Noodles Roast Beef & Onion Flavour","Pack","UK",3.25,"0",0
"1296",1285,"Lucky Me!","Supreme Chow Mein Seafood Flavor Instant Stir-Fried Noodles","Bowl","Philippines",3.25,"0",0
"1297",1284,"Thai Kitchen","Rice Noodle Cart Sweet Citrus Ginger","Tray","USA",4.25,"0",0
"1298",1283,"Nongshim","Oolongmen Kimchi Cup Noodle Soup Mix","Cup","South Korea",4,"0",0
"1299",1282,"Koka","Purple Wheat Noodles Aglio Olio","Pack","Singapore",2.75,"0",0
"1300",1281,"Tokachimen Koubou","Jet Black Sesame Oil Pork Tonkotsu","Bowl","Japan",2.25,"0",0
"1301",1280,"Deshome","Sun Dried Noodle Chlorella Powder Noodle With Curry Sauce","Pack","Taiwan",5,"0",0
"1302",1279,"Ko-Lee","Instant Noodles Mixed Vegetable","Pack","UK",3.5,"0",0
"1303",1278,"Ottogi","Ppushu Ppushu Noodle Snack Bulgogi Flavor","Pack","South Korea",3.25,"0",0
"1304",1277,"Vifon","M G Tm Chua Cay Hot & Sour Chicken Flavor Instant Noodles","Pack","Vietnam",2,"0",0
"1305",1276,"Adabi","Mi Bandung Prawn Mee","Pack","Malaysia",4.25,"0",0
"1306",1275,"Wu-Mu","Ramen With Stewed Pork Flavor","Pack","Taiwan",4.5,"0",0
"1307",1274,"Wu-Mu","Shiitake Flavor Spinach Ramen","Pack","Taiwan",3.75,"0",0
"1308",1273,"Sainsbury's","Basics Instant Noodles Chicken Curry Flavour","Pack","UK",3.25,"0",0
"1309",1272,"Samyang Foods","Baked Noodle Spicy Grilled Beef Ramyun","Pack","South Korea",3.5,"0",0
"1310",1271,"Prima Taste","Singapore Chilli Crab La Mian","Pack","Singapore",5,"2014",8
"1311",1270,"Ko-Lee","Instant Noodles Taste Sensations Creamy Shrimp Tom Yum Flavour","Pack","UK",5,"0",0
"1312",1269,"Chewy","Rice Vermicelli Scallop With XO Sauce Flavour","Pack","Hong Kong",2.5,"0",0
"1313",1268,"Wu-Mu","Dried Noodle With Jah Jan Sauce","Pack","Taiwan",3.25,"0",0
"1314",1267,"ABC","Mi Cup Rasa Soto Ayam Chicken Soto Flavour","Cup","Indonesia",3.75,"0",0
"1315",1266,"ABC","Selera Pedas Mi Goreng Cup Rasa Gulai Ayam Pedas Hot Gulai Chicken","Cup","Indonesia",4,"0",0
"1316",1265,"ABC","Rasa Ayam Bawang Chicken Onion Flavour","Cup","Indonesia",3.75,"0",0
"1317",1264,"ABC","Selera Pedas Mi Goreng Cup Rasa Ayam Pedas Limau Hot Chicken Lemon Flavour","Cup","Indonesia",4.25,"0",0
"1318",1263,"Nissin","Cup Noodle Curry X Gunpla RX-78-2 Gundam","Cup","Japan",4.25,"0",0
"1319",1262,"ABC","Mi Cup Rasa Kari Ayam Chicken Curry Flavour","Cup","Indonesia",3.75,"0",0
"1320",1261,"Eat & Go","Rasa Baso Sapi Meat Ball Mi Instan Cup","Cup","Indonesia",3.75,"0",0
"1321",1260,"ABC","Mi Goreng Pangsit Fried Noodle With Dumpling","Pack","Indonesia",5,"0",0
"1322",1259,"Eat & Go","Chicken Onion Mi Instan Cup","Cup","Indonesia",3.75,"0",0
"1323",1258,"President","Mi Goreng Rasa Ayam Chicken Flavoured Fried Noodle","Pack","Indonesia",4.5,"0",0
"1324",1257,"ABC","Mi Goreng Spesial Special Fried Noodle","Cup","Indonesia",4,"0",0
"1325",1256,"Eat & Go","Curry Chicken Mi Instan Cup","Cup","Indonesia",4.25,"0",0
"1326",1255,"Thai Choice","Instant Noodles Shrimp Flavour","Cup","Thailand",3.25,"0",0
"1327",1254,"Four Seas","Sesame Oil Chicken Flavour Instant Noodle","Bowl","Hong Kong",2.75,"0",0
"1328",1253,"Nissin","Chow Mein Teriyaki Chicken Flavor Chow Mein Noodles","Tray","USA",3.75,"0",0
"1329",1252,"Tesco","Instant Noodles Chow Mein Flavour","Pack","UK",2.25,"0",0
"1330",1251,"Mama","Instant Noodles Tom Saab Flavour","Pack","Thailand",3.5,"0",0
"1331",1250,"Samyang Foods"," (Samyang Ramyun) (South Korean Version)","Bowl","South Korea",3.75,"0",0
"1332",1249,"Nissin","Sabor A Pollo Sopa Con Fideos","Cup","Colombia",2.75,"0",0
"1333",1248,"Wu-Mu","Beef Flavour Tomato Ramen","Pack","Taiwan",4,"0",0
"1334",1247,"Maruchan","I Want To Eat Ramen Pork Tonkotsu Flavor","Pack","Japan",4,"0",0
"1335",1246,"Annie Chun's","Ramen House Chicken Vegetable Flavored Ramen","Pack","USA",4,"0",0
"1336",1245,"Sau Tao","Instant Noodle King Abalone & Chicken Flavoured","Pack","Hong Kong",3.5,"0",0
"1337",1244,"Unif","Unif-100 Pickled Cayenne Flavor Beef Ramen","Pack","China",3.75,"0",0
"1338",1243,"Nissin","Demae Rice Vermicelli Chicken Flavour Instant Rice Vermicelli With Soup Base","Pack","Hong Kong",1.75,"0",0
"1339",1242,"Thai Pavilion","Garlic Chili Instant Rice Noodles & Sauce","Tray","USA",4,"0",0
"1340",1241,"Nissin","Donbei Kansai Soy Sauce Flavor Udon","Pack","Japan",3.75,"0",0
"1341",1240,"Maggi","Big Kari Perencah (Big Curry Flavor) 2 Minute Noodles","Pack","Malaysia",4,"0",0
"1342",1239,"SuperMi","Rasa Ayam Spesial","Pack","Indonesia",4,"0",0
"1343",1238,"Sapporo Ichiban","Sesame Ramen","Pack","Japan",5,"0",0
"1344",1237,"Mama","Instant Noodles Creamy Tom Yum Minced Pork Flavour","Pack","Thailand",3.5,"0",0
"1345",1236,"Emart","Dare You Habanero Ramyun","Cup","South Korea",3.25,"0",0
"1346",1235,"Nissin","Demae Ramen Miso Tonkotsu Artificial Pork Flavor Ramen Noodle","Pack","Hong Kong",3.75,"0",0
"1347",1234,"Sainsbury's","Barbecue Beef Flavour Instant Noodles","Pack","UK",2.75,"0",0
"1348",1233,"Nissin","Sabor A Pollo Sopa Instantnea Con Fideos","Pack","Colombia",3.25,"0",0
"1349",1232,"GaGa","Mie Gepeng Kuah Rasa Ayam Bawang Pedas","Pack","Indonesia",3.25,"0",0
"1350",1231,"A-Sha Dry Noodle","Instant Noodle Shallot Flavor","Pack","Taiwan",3.75,"0",0
"1351",1230,"Saji","Sajimee Original Soto Soup Flavor","Pack","Malaysia",4,"0",0
"1352",1229,"Kumamoto","Tonkotsu Ramen MEGA Dragon","Pack","Japan",2.5,"0",0
"1353",1228,"Maruchan","Seimen Japanese Instant Ramen Noodles Shio Aji","Pack","Japan",3.75,"0",0
"1354",1227,"Mr. Noodles","Chicken Kimchi Oriental Style Noodles With Soup Base","Bowl","Canada",0.5,"0",0
"1355",1226,"Master Kong","Artificial Braised Beef Flavor Instant Noodle","Bowl","China",3.75,"0",0
"1356",1225,"Nissin","Pan Asian Kitchen Sweet & Sour Chicken Flavor Ramen Noodles","Tray","USA",3.75,"0",0
"1357",1224,"HoMyeonDang","Premium Noodle House Seafood Ramyun","Pack","South Korea",4,"0",0
"1358",1223,"Sawadee","Instant Noodles Prawn Oriental Flavour","Pack","Malaysia",2.5,"0",0
"1359",1222,"Nissin","Soba Classic Noodles With Japanese Yakisoba Sauce","Cup","Germany",3.75,"0",0
"1360",1221,"ABC","Selera Pedas Hot Semur Chicken Flavour","Pack","Indonesia",4.5,"0",0
"1361",1220,"Nissin","Ultraman Instant Noodle Pork Flavour","Cup","Japan",3,"0",0
"1362",1219,"Tokyo Noodle","Mini Instant Noodle Spicy Flavor","Pack","Japan",3.5,"0",0
"1363",1218,"Sau Tao","Ho Fan Beef Soup Flavored","Pack","China",3.75,"0",0
"1364",1217,"Doll","Hello Kitty Dim Sum Noodle Japanese Curry Flavour","Cup","Hong Kong",3.5,"0",0
"1365",1216,"Batchelors","Super Low Fat Noodles Chilli Chicken Flavour","Pack","UK",1,"0",0
"1366",1215,"GaGa","Mi Instan Cup Milk Chicken Soup","Cup","Indonesia",4.75,"0",0
"1367",1214,"Eat & Go","Rendang Beef Flavour Fried Instant Noodle","Cup","Indonesia",5,"0",0
"1368",1213,"Nan Jie Cun","Hot -Dry Instant Noodles Chilli Flavour","Tray","China",0.5,"0",0
"1369",1212,"Ruski","Instant Noodles Tom Yum Flavour","Pack","Thailand",3.5,"0",0
"1370",1211,"Nissin","Demae Iccho Instant Noodle With Soup Base Artificial Chicken Flavour","Bowl","Hong Kong",3,"0",0
"1371",1210,"A-Sha Dry Noodle","Hell Spicy Mala","Pack","Taiwan",4,"0",0
"1372",1209,"Batchelors","Super Noodles Chicken Mushroom Flavour","Pack","UK",3.25,"0",0
"1373",1208,"Golden Wheat","Korean Style Stew Prok Flavour Cooking Noodle","Pack","China",3.5,"0",0
"1374",1207,"Nissin","UFO Yakisoba With Wasabi Mayonnaise","Bowl","Japan",5,"0",0
"1375",1206,"China Best","Frozen Satay Sauce Noodle","Pack","Taiwan",1,"0",0
"1376",1205,"Mama","Instant Noodles Pork Flavour With Black Pepper","Pack","Thailand",3.5,"0",0
"1377",1204,"Nissin","Cup Noodles Sabor A Gallina","Cup","Colombia",3.5,"0",0
"1378",1203,"GaGa","Mie Gepeng Kuah Rasa Soto Cabe Hijau","Pack","Indonesia",3.5,"0",0
"1379",1202,"Sugakiya Foods","Udon Miso Stew","Pack","Japan",3.25,"0",0
"1380",1201,"A-Sha Dry Noodle","Instant Noodle Curry Flavour","Pack","Taiwan",4.25,"0",0
"1381",1200,"Men-Sunaoshi","Tonkotsu Ramen","Pack","Japan",3.75,"0",0
"1382",1199,"Mama","Instant Noodles Chicken Green Curry Flavour","Pack","Thailand",3.75,"0",0
"1383",1198,"Samyang Foods","Maesaengyitangmyun Baked Noodle","Pack","South Korea",5,"2014",5
"1384",1197,"Nissin","Cup Noodle Chilli Tomato","Cup","Japan",4.5,"0",0
"1385",1196,"Nissin","Bowl Noodles Chicken Flavor","Bowl","USA",3.5,"0",0
"1386",1195,"Sawadee","Instant Noodles Spicy Tomato Flavour","Pack","Malaysia",2.5,"0",0
"1387",1194,"Paldo","Namja Ramyun (US Version)","Bowl","South Korea",4,"0",0
"1388",1193,"Nissin","Soba Curry Noodles With Japanese Yakisoba Sauce","Cup","Germany",3.75,"0",0
"1389",1192,"Wu-Mu","Ramen With Simmered Pork Flavor","Pack","Taiwan",3.75,"0",0
"1390",1191,"GaGa","Seribu 1000 Goreng Spesial","Pack","Indonesia",4,"0",0
"1391",1190,"Sanrio","Hello Kitty Hakata Shoyutonkotsu Ramen","Bowl","Japan",3.75,"0",0
"1392",1189,"Acecook","Comet Mori Yukino Tan-tan men","Bowl","Japan",5,"0",0
"1393",1188,"Chencun","Braised Pork Ribs","Cup","China",3,"0",0
"1394",1187,"Nongshim","Shin Ramyun Cup","Cup","South Korea",3.5,"0",0
"1395",1186,"Nissin","Sabor A Carne Sopa Instantnea Con Fideos","Pack","Colombia",3.75,"0",0
"1396",1185,"Sainsbury's","Basics Instant Noodles Chicken Flavour","Pack","UK",3.25,"0",0
"1397",1184,"Sapporo Ichiban","Pokemon Shoyu Ramen","Cup","Japan",3.5,"0",0
"1398",1183,"Paldo","Cheese Noodle","Pack","South Korea",5,"2014",6
"1399",1182,"Ko-Lee","Go Noodles Xtreme Hot & Spicy Flavour","Pack","UK",3.75,"0",0
"1400",1181,"Samyang Foods","Star Popeye Ramyun Snack","Pack","South Korea",4,"0",0
"1401",1180,"Wei Lih","Whats That? Leisure Meatballs Spicy Chicken Flavor","Pack","Taiwan",3.75,"0",0
"1402",1179,"Myojo","Chukazanmai Guangdong Style Ramen","Pack","Japan",4.25,"0",0
"1403",1178,"Nongshim","Shin Black Spicy Pot-au-feu Flavor Premium Noodle Soup","Cup","USA",5,"0",0
"1404",1177,"ABC","Mi ABC Rasa Ayam Bawang (Onion Chicken)","Pack","Indonesia",4,"0",0
"1405",1176,"Maruchan","Old Style Shio Ramen","Pack","Japan",3.5,"0",0
"1406",1175,"Healtimie","Green Barley Noodle Milk Chicken Soup","Pack","Indonesia",4.25,"0",0
"1407",1174,"Itomen","Crab Flavor Instant Ramen","Pack","Japan",4,"0",0
"1408",1173,"Pop Bihun","Spesial Goreng Special","Pack","Indonesia",3.5,"0",0
"1409",1172,"Koyo","Seaweed Ramen Made With Organic Noodles","Pack","USA",2.75,"0",0
"1410",1171,"Tiger Tiger","Traveller's Choice Indian Tikka Masala Flavour","Pack","UK",3,"0",0
"1411",1170,"Acecook","Jan Jan Yakisoba","Cup","Japan",3.75,"0",0
"1412",1169,"Mr. Noodles","Noodles In A Cup Beef Simulated Flavour","Cup","Canada",1.75,"0",0
"1413",1168,"Nissin","Donbei Curry Udon (West Japanese)","Bowl","Japan",3.25,"0",0
"1414",1167,"Kabuto Noodles","Miso Ramen","Cup","UK",3.75,"0",0
"1415",1166,"Unif","Man Han Feast Sichuan Chilli Eel Flavor","Bowl","Taiwan",5,"0",0
"1416",1165,"Nissin","Chow Mein With Shrimp Chow Mein Noodles","Tray","USA",3.75,"0",0
"1417",1164,"Mr. Noodles","Bowl Chicken Simulated Flavour","Bowl","Canada",2,"0",0
"1418",1163,"Chewy","Rice Vermicelli Spicy Beef With Chilli Flavour","Pack","China",3.25,"0",0
"1419",1162,"Nissin","Chanpon Ramen","Pack","Japan",4.75,"0",0
"1420",1161,"GaGa","100 Green Chilli Soto Flavour","Pack","Indonesia",3.75,"0",0
"1421",1160,"Samyang Foods","Chacharoni","Pack","South Korea",3.75,"0",0
"1422",1159,"Peyang","Yakisoba","Tray","Japan",5,"0",0
"1423",1158,"Nissin","Demae Iccho XO Sauce Seafood Flavour","Bowl","Hong Kong",4,"0",0
"1424",1157,"Golden Wonder","The Nation's Noodle Beef & Tomato Flavour","Cup","UK",4.25,"0",0
"1425",1156,"Vifon","Oriental Style Instant Vermicelli Sour Crab Flavour Soup","Pack","Vietnam",3.75,"0",0
"1426",1155,"Komforte Chockolates","Savory Ramen ","Bar","USA",5,"0",0
"1427",1154,"Golden Wheat","Korean Style Shrimp Flavour Cooking Noodle","Pack","China",3.5,"0",0
"1428",1153,"Wu-Mu","Spicy Flavor Tomato Ramen","Pack","Taiwan",4,"0",0
"1429",1152,"Sapporo Ichiban","Tomato & Basil Shio Ramen","Pack","Japan",4,"0",0
"1430",1151,"Asian Thai Foods","Fatafat Vegetable Flavor","Pack","Nepal",3.75,"0",0
"1431",1150,"Asian Thai Foods","Krrish Instant Noodles Chicken Flavor","Pack","Nepal",3.5,"0",0
"1432",1149,"Asian Thai Foods","Preeti Instant Noodles Chicken Soup Base","Pack","Nepal",3.5,"0",0
"1433",1148,"Asian Thai Foods","Miteri Instant Noodles Vegetable Flavor","Pack","Nepal",3.5,"0",0
"1434",1147,"Asian Thai Foods","Rumpum Chicken Soup Base","Pack","Nepal",3.5,"0",0
"1435",1146,"Asian Thai Foods","2pm Precooked Noodles Chicken Curry Delight","Pack","Nepal",3.5,"0",0
"1436",1145,"Asian Thai Foods","Fatafat Chicken Flavor","Pack","Nepal",3.75,"0",0
"1437",1144,"Asian Thai Foods","Krrish Instant Noodles Vegetable Curry Flavor","Pack","Nepal",3.5,"0",0
"1438",1143,"Asian Thai Foods","Rumpum Vegetable Soup Base","Pack","Nepal",4.25,"0",0
"1439",1142,"Asian Thai Foods","Miteri Instant Noodles Chicken Flavor","Pack","Nepal",4,"0",0
"1440",1141,"Asian Thai Foods","Joker Ready To Eat Noodles","Pack","Nepal",3.25,"0",0
"1441",1140,"Asian Thai Foods","Preeti Instant Noodles Veg Soup Base","Pack","Nepal",5,"0",0
"1442",1139,"Asian Thai Foods","Gaurav Chicken Seasoning","Pack","Nepal",3.75,"0",0
"1443",1138,"Tablemark","Downtown Ramen Shop Shoyu","Pack","Japan",4.75,"0",0
"1444",1137,"Koka","Oriental Style Instant Noodles Crab Flavour","Pack","Singapore",3.75,"0",0
"1445",1136,"Nissin","Yakisoba","Pack","Japan",5,"0",0
"1446",1135,"Indomie","Instant Noodle Beef & Lime Flavour","Pack","Indonesia",4.25,"0",0
"1447",1134,"Hi-Myon","Katsuo Udon","Pack","South Korea",4,"0",0
"1448",1133,"Kamfen","E-Men Noodles Abalone Soup Flavor","Pack","Hong Kong",3.75,"0",0
"1449",1132,"Tesco","Everyday Value Spicy Curry Flavour Noodles","Cup","UK",1.5,"0",0
"1450",1131,"Wei Lih","Whats That? Leisure Meatballs Chicken Flavor","Pack","Taiwan",3.75,"0",0
"1451",1130,"Nissin","Big Cup Noodles Habanero Lime Shrimp Flavor Ramen Noodle Soup","Cup","USA",3.5,"0",0
"1452",1129,"Oyatsu","Baby Star Ramen Round Chikinmini","Pack","Japan",3.5,"0",0
"1453",1128,"Lucky Me!","Special Instant Pancit Bihon With Kalamansi","Pack","Philippines",3.25,"0",0
"1454",1127,"Campbell's","Hearty Noodles Chicken Flavour","Cup","Canada",2.75,"0",0
"1455",1126,"GaGa","Mie Jepeng Goreng Rasa Ayam Lada Hitam","Pack","Indonesia",4,"0",0
"1456",1125,"Myojo","Japanese Style Noodles Shio Flavor","Pack","USA",5,"0",0
"1457",1124,"Samyang Foods","Ganjjampong","Bowl","South Korea",4.25,"0",0
"1458",1123,"Maruchan","Fresh Yaki-Soba Stir Fry Noodles With Seasoning Sauce Base","Pack","Japan",4.25,"0",0
"1459",1122,"Nagao Noodle","Ramen Kamen Thasos Galle Pork Bone","Pack","Japan",4.25,"0",0
"1460",1121,"Sau Tao","Oat Noodle Sesame Oil Flavored","Pack","China",3.75,"0",0
"1461",1120,"ABC","Selera Pedas Mi Rebus Hot Gulai Flavor","Pack","Indonesia",4.75,"0",0
"1462",1119,"Ko-Lee","Taste Sensation Instant Noodles Curry Flavour","Pack","UK",3.75,"0",0
"1463",1118,"Mr. Noodles","Kimchi Bowl Noodles Oriental Noodle With Soup Base","Bowl","Canada",2.75,"0",0
"1464",1117,"Thai Pavilion","spicy Pad Thai Instant Noodles & Sauce","Tray","USA",4.25,"0",0
"1465",1116,"Tokyo Noodle","Mini Instant Noodles Artificial Chicken Flavor","Pack","Japan",5,"0",0
"1466",1115,"Nissin","Pan Asian Kitchen Sukiyaki Beef Flavor Savory Soy Sauce Ramen Noodles","Tray","USA",3.75,"0",0
"1467",1114,"Maitri","Vegetarian Fried Noodles (Mie Goreng)","Pack","Indonesia",4,"0",0
"1468",1113,"Samyang Foods","Samyang Ramyun (SK Version)","Cup","South Korea",3.5,"0",0
"1469",1112,"Mama","Oriental Style Instant Kua-Chap Clear Soup","Pack","Thailand",3.75,"0",0
"1470",1111,"Golden Wheat","Korean Style Stew Beef Cooking Noodle","Pack","China",3.25,"0",0
"1471",1110,"GS25","Gonghwachun Jjajangmyun","Pack","South Korea",4.5,"0",0
"1472",1109,"La Fonte","Spaghetti With Bolognese Sauce","Box","Indonesia",4.25,"0",0
"1473",1108,"Chencun","Spicy Beef","Cup","China",3.5,"0",0
"1474",1107,"Nissin","Demae Ramen Kimchi Flavour Instant Noodle With Soup Base","Bowl","Hong Kong",3.5,"0",0
"1475",1106,"Nissin","Raoh Rich Soy Sauce With Roast Pork (2 Slices)","Bowl","Japan",4.5,"0",0
"1476",1105,"Nongshim","Doong Ji Authentic Korean Cold Noodles With Chili Sauce","Tray","South Korea",5,"0",0
"1477",1104,"Western Family","Instant Noodles Chicken Flavour","Pack","Canada",3.5,"0",0
"1478",1103,"Myojo","Ippei-chan Yomise No Yakisoba Teriyaki Mayo Flavor","Tray","Japan",5,"0",0
"1479",1102,"Batchelors","Super Noodles Mild Mexican Chilli","Pack","UK",3,"0",0
"1480",1101,"Eat & Go","Spicy Chicken Mi Instan Cup","Cup","Indonesia",4.25,"0",0
"1481",1100,"Baltix","Instant Noodles With Chicken Flavour Broth","Pack","Estonia",3.75,"0",0
"1482",1099,"Baltix","Instant Noodles With Beef Flavour Broth","Pack","Estonia",3.25,"0",0
"1483",1098,"Tropicana Slim","Low Fat Noodles Hainan Chicken","Pack","Indonesia",3.75,"0",0
"1484",1097,"Amianda","Homely Dried Noodles - Sesame Pate","Pack","Taiwan",3.75,"0",0
"1485",1096,"Amianda","Tachia Noodles - Hot & Spicy Sauce","Pack","Taiwan",3.5,"0",0
"1486",1095,"Amianda","Tachia Dried Noodles - Fried Shallot","Pack","Taiwan",3.25,"0",0
"1487",1094,"Amianda","Thin Noodles - Sesame Oil","Pack","Taiwan",4.25,"0",0
"1488",1093,"Amianda","Hakka Flat Noodles - Satay Sauce","Pack","Taiwan",4.5,"0",0
"1489",1092,"Amianda","Tachia Dried Noodles - Rou Zhou Meat Sauce","Pack","Taiwan",5,"0",0
"1490",1091,"Amianda","Homely Dried Noodles - Original Flavor ","Pack","Taiwan",4,"0",0
"1491",1090,"Amianda","Dried Noodles - Spicy Sauerkraut","Pack","Taiwan",3.25,"0",0
"1492",1089,"Amianda","Hakka Flat Noodles - Fried Bean Sauce","Pack","Taiwan",4.25,"0",0
"1493",1088,"Amianda","Tachia Dried Noodles - Peppery","Pack","Taiwan",3.75,"0",0
"1494",1087,"MyKuali","Penang White Curry Noodle","Pack","Malaysia",5,"2014",1
"1495",1086,"Sawadee","Indian Curry Flavour","Pack","UK",3,"0",0
"1496",1085,"Vina Acecook","Hao Hao Mi Goreng Shrimp & Onion Flavour","Pack","Vietnam",3.5,"0",0
"1497",1084,"Mr. Noodles","Noodles In A Cup Chicken Simulated Flavour","Cup","Canada",1.5,"0",0
"1498",1083,"Nissin","GooTa Demi Hamburg-Men","Cup","Japan",4.75,"0",0
"1499",1082,"Indomie","Mi Goreng Cabe Ijo","Pack","Indonesia",4.5,"0",0
"1500",1081,"Deshome","Aloe Noodle Sesame Sauce","Pack","Taiwan",3.25,"0",0
"1501",1080,"Deshome","Black Eyed Beans Noodle Basil Sauce & Sesame Sauce","Pack","Taiwan",3.5,"0",0
"1502",1079,"Deshome","Aloe Noodle Vegetable Sauce","Pack","Taiwan",5,"0",0
"1503",1078,"Deshome","Black Eyed Beans Noodle Spicy Soybean Sauce & Sesame Sauce","Pack","Taiwan",3.75,"0",0
"1504",1077,"Deshome","Aloe Noodle Red Onion & Sesame Sauce","Pack","Taiwan",5,"0",0
"1505",1076,"Deshome","Black Eyed Beans Noodle Vegetable Sauce & Sesame Sauce","Pack","Taiwan",3.75,"0",0
"1506",1075,"Deshome","Aloe Noodle With Basil Sauce","Pack","Taiwan",5,"0",0
"1507",1074,"Deshome","Pollen Noodles Sesame Sauce & Soy Sauce","Pack","Taiwan",4.25,"0",0
"1508",1073,"Deshome","Black Eyed Bean Noodle Red Onion Sauce & Sesame Sauce","Pack","Taiwan",3.75,"0",0
"1509",1072,"Deshome","Aloe Noodle With Spicy Soybean Sauce","Pack","Taiwan",4,"0",0
"1510",1071,"Nissin","Raoh Soy Sauce Taste","Pack","Japan",4,"0",0
"1511",1070,"HoMyeonDang","Premium Noodle House Pork & Seafood Flavor","Pack","South Korea",4,"0",0
"1512",1069,"Nissin","Raoh Rich Miso Flavor","Bowl","Japan",5,"0",0
"1513",1068,"Koka","Oriental Instant Noodles Stir Fried Noodles","Pack","Singapore",3.75,"0",0
"1514",1067,"Nissin","Cup Noodle Red Shock","Cup","Japan",3.75,"0",0
