"","review","brand","variety","style","country","stars","year","top_ten"
"615",1966,"Wei Lih","GGE Noodle Snack Wheat Crackers Soy Sauce Ramen","Pack","Taiwan",3.75,"0",0
"616",1965,"MyKuali","Penang Spicy Prawn Soup Noodle Authentic Taste","Pack","Malaysia",5,"0",0
"617",1964,"MAMA","Instant Noodles Coconut Milk Flavour","Pack","Myanmar",5,"2016",10
"618",1963,"Kabuto Noodles","Rice Noodles Vegetable Laksa","Cup","UK",3.75,"0",0
"619",1962,"Kabuto Noodles","Rice Noodles Chicken Pho","Cup","UK",3.5,"0",0
"620",1961,"Kabuto Noodles","Chicken Ramen","Cup","UK",4.25,"0",0
"621",1960,"Kabuto Noodles","Chilli Chicken Ramen","Cup","UK",4,"0",0
"622",1959,"Myojo","Charumera Shoyu Ramen","Pack","Japan",4,"0",0
"623",1958,"IbuRamen","Mi Goreng Bento Noodles In A Box Curry Masala Flavour","Tray","USA",4,"0",0
"624",1957,"MAMA","Cup Vegetarian Instant Noodles Tom Yum Flavour","Cup","Thailand",4,"0",0
"625",1956,"Maruchan","Spicy Tomato Salsa Ramen","Cup","Japan",0,"0",0
"626",1955,"Nissin","Raoh Ramen Noodle Soup Umami Soy Sauce Flavor","Pack","USA",4.75,"0",0
"627",1954,"Koh Thai","Island Of Flavours Spicy Thai Chicken Instant Noodles Soup","Pack","Netherlands",2,"0",0
"628",1953,"Prima Taste","Singapore Fish Soup La Mian","Pack","Singapore",5,"0",0
"629",1952,"Ve Wong","Kung-Fu Brand Instant Oriental Noodle Soup Artificial Beef Flavor","Pack","Taiwan",3.75,"0",0
"630",1951,"Nissin","Cup Noodles Ramen Noodle Soup Hearty Chicken Flavor [New Package]","Cup","USA",4.25,"0",0
"631",1950,"Fujiwara","Red King Crab Flavour Ramen","Pack","Japan",4,"0",0
"632",1949,"Bamee","Oriental Style Instant Noodles Shrimp Flavour (Tom Yum)","Pack","Thailand",3.5,"0",0
"633",1948,"Sichuan Baijia","Artificial Pickled Cabbage Fish Flavor Instant Vermicelli","Pack","China",1.5,"0",0
"634",1947,"Prima Taste","Singapore Laksa Wholegrain La Mian","Pack","Singapore",5,"2016",1
"635",1946,"Nissin","Raoh Shio Ramen","Pack","Japan",4.75,"0",0
"636",1945,"MAMA","Oriental Style Instant Noodles Masala Flavour","Pack","Bangladesh",3.5,"0",0
"637",1944,"Wei Lih","GGE Noodle Snack Wheat Crackers Hot Spicy","Pack","Taiwan",5,"0",0
"638",1943,"New Touch","Sugomen Niigata Seabura Shoyu Ramen","Bowl","Japan",5,"0",0
"639",1942,"Ibumie","Always Mi Goreng Perisa Sambal Udang","Pack","Malaysia",3.5,"0",0
"640",1941,"Unox","Good Noodles Tandoori","Pack","Netherlands",2.5,"0",0
"641",1940,"Nissin","Cup Noodle Pasta Style Bolognese","Cup","Japan",5,"0",0
"642",1939,"MAMA","Instant Noodles Shrimp Creamy Tom Yum Flavour","Pack","Myanmar",5,"0",0
"643",1938,"Nissin","Donbei Kamodashi Soba","Bowl","Japan",5,"0",0
"644",1937,"MAMA","Chicken Soup Flavour Cup Noodles","Cup","Myanmar",3.75,"0",0
"645",1936,"Fortune","Rice Noodle Coconut Curry","Pack","USA",1,"0",0
"646",1935,"Love Cook","Guanmiao Dried Noodles With Oleum Sesami","Pack","Taiwan",3.75,"0",0
"647",1934,"Love Cook","Guanmiao Dried Noodles With Spicy Sauce","Pack","Taiwan",5,"0",0
"648",1933,"Love Cook","Guanmiao Dried Noodles With Authentic Sauce","Pack","Taiwan",4.5,"0",0
"649",1932,"Love Cook","Guanmiao Dried Noodles With Shallot Flavor","Pack","Taiwan",3.75,"0",0
"650",1931,"Bonasia","Instant Noodles chicken Flavour","Pack","Hungary",3.75,"0",0
"651",1930,"Koh Thai","Island Of Flavours Lemongrass Instant Noodles Soup","Pack","Netherlands",0.25,"0",0
"652",1929,"MAMA","Instant Noodles Minced Pork Flavour","Pack","Cambodia",3.5,"0",0
"653",1928,"Bamee","Instant Noodles Oriental Style Chicken Flavour","Pack","Thailand",3,"0",0
"654",1927,"Marutai","Kogashi Megiiri Tonkotsu Kagoshima Ramen","Bowl","Japan",3.5,"0",0
"655",1926,"Nissin","Bowl Noodles Hot & Spicy Chicken Flavor Less Sodium Ramen Noodle Soup","Bowl","USA",4,"0",0
"656",1925,"Prima","Juzz's Mee Creamy Chicken Flavour","Pack","Singapore",5,"2016",8
"657",1924,"Sichuan Baijia","Broad Noodle Artificial Beef Flavor","Pack","China",3.5,"0",0
"658",1923,"Conimex","Oriental Noodles Teriyaki","Cup","Netherlands",0.5,"0",0
"659",1922,"Mie Sedaap","Instant Cup Mi Kuah Rasa Baso Spesial","Cup","Indonesia",1.5,"0",0
"660",1921,"Nissin","Cup Noodles Ramen Noodle Soup Chicken Flavor [New Package]","Cup","USA",3.5,"0",0
"661",1920,"Itsuki","Ramen Tonkotudou Kumamoto Noodles","Pack","Japan",0.75,"0",0
"662",1919,"Maruchan","Shiroi Chikara Mochi Udon","Bowl","Japan",4.5,"0",0
"663",1918,"iMee","Instant Noodles chicken Flavour","Pack","Netherlands",3.5,"0",0
"664",1917,"IbuRamen","Mi Goreng Bento Noodles In A Box Hot Sweet & Sour Flavor","Tray","USA",0.25,"0",0
"665",1916,"Nissin","Soba Fried Noodles Teriyaki","Pack","Germany",3,"0",0
"666",1915,"Itsuki","Yuzu Sesame Sauce Udon","Bowl","Japan",4.5,"0",0
"667",1914,"Prima","Juzz's Mee Curry Flavour","Pack","Singapore",5,"0",0
"668",1913,"Thai Smile","Mushroom Rice Noodle Soup Bowl","Bowl","USA",0,"0",0
"669",1912,"MAMA","Instant Noodles Chicken Sichek Flavour","Pack","Myanmar",3.75,"0",0
"670",1911,"Nissin","Emergency Chikin Ramen Cup Noodle","Cup","Japan",5,"0",0
"671",1910,"Nissin","Chow Mein Pad Thai","Tray","USA",3,"0",0
"672",1909,"Asia Gold","Instant Noodles With Chicken Flavouring","Pack","Hungary",3.5,"0",0
"673",1908,"Nissin","Kuroma-yu Tonkotsu Kumamoto Ramen","Bowl","Japan",4.75,"0",0
"674",1907,"Prima Taste","Singapore Curry Wholegrain La Mian","Pack","Singapore",5,"2016",5
"675",1906,"Vifon","Chicken Flavour Asian Style Instant Noodles","Pack","Vietnam",3.5,"0",0
"676",1905,"Pirkka","Nuudeli Kana Nudlar Kyckling","Pack","Finland",3.5,"0",0
"677",1904,"Bonasia","Instant Noodles Duck Flavour","Pack","Hungary",3,"0",0
"678",1903,"Higashimaru","Tonkotsu Ramen","Pack","Japan",4.5,"0",0
"679",1902,"MAMA","Seafood Tom Yum Sichek Flavour","Pack","Myanmar",5,"0",0
"680",1901,"Prima","Juzz's Mee Original Spicy Flavour","Pack","Singapore",5,"0",0
"681",1900,"Ibumie","Always Mi Goreng Perisa Kari Kapitan","Pack","Malaysia",5,"0",0
"682",1899,"Koh Thai","Island Of Flavours Thai Royal Shrimp Instant Noodles","Pack","Netherlands",1.5,"0",0
"683",1898,"Master Kong","Spicy Fish Noodle","Bowl","China",3,"0",0
"684",1897,"Nissin","Cup Noodle Massaman Curry","Cup","Japan",3.5,"0",0
"685",1896,"Asia Gold","Instant Noodles Duck Flavour","Pack","Hungary",3.5,"0",0
"686",1895,"Maruchan","Seimen Houjyun Koku Shoyu","Bowl","Japan",5,"0",0
"687",1894,"MAMA","Rangers Snack Noodles BBQ Flavour","Pack","Myanmar",2.75,"0",0
"688",1893,"Nissin","Cup Noodle Sio","Cup","Japan",5,"0",0
"689",1892,"Ottogi","Cheese Ramen","Pack","South Korea",4,"0",0
"690",1891,"Nissin","Cup Noodles Homestyle Chicken","Cup","USA",3.5,"0",0
"691",1890,"Kuriki","Beef Tongue Shio Mayo Ramen","Pack","Japan",4.5,"0",0
"692",1889,"MAMA","Rangers Snack Noodles Sour Cream Flavour","Pack","Myanmar",2.75,"0",0
"693",1888,"Nissin","Cup Noodles Kyushu White Flavour","Cup","Singapore",3.5,"0",0
"694",1887,"Myojo","Mee Poh Dry","Pack","Singapore",4.25,"0",0
"695",1886,"Myojo","Chicken Abalone Flavour","Bowl","Singapore",3.75,"0",0
"696",1885,"Myojo","Ramen Char Mee 100","Pack","Singapore",3,"0",0
"697",1884,"Myojo","La Ramen Spicy Mushroom Flavour Big Bowl","Bowl","Singapore",4.5,"0",0
"698",1883,"Myojo","Mee Goreng","Pack","Singapore",4,"0",0
"699",1882,"Myojo","La Ramen Spicy Lobster Hot Pot Flavour Big Bowl","Bowl","Singapore",4.75,"0",0
"700",1881,"Myojo","Chicken Abalone Flavour","Pack","Singapore",3.5,"0",0
"701",1880,"Myojo","Thai Tom Yam Flavour","Bowl","Singapore",3.75,"0",0
"702",1879,"Myojo","Chicken Tanmen Flavour","Pack","Singapore",3.5,"0",0
"703",1878,"Myojo","Extra Spicy Singapore Curry Big Bowl","Bowl","Singapore",5,"0",0
"704",1877,"Myojo","La Ramen Spicy Mushroom Flavour","Pack","Singapore",4.5,"0",0
"705",1876,"Myojo","Chicken Flavour","Pack","Singapore",3.75,"0",0
"706",1875,"Sapporo Ichiban","Tonkotsu Ramen Artificially Flavored Tonkotsu White Chicken Broth","Pack","USA",5,"0",0
"707",1874,"Ibumie","Always Mi Goreng Perisa Thai Tom Yam","Pack","Malaysia",2.5,"0",0
"708",1873,"Vedan","Wei Wei A Instant Noodles Chicken Flavor","Bowl","Taiwan",0,"0",0
"709",1872,"Itsuki","Hakata Ossyoi","Pack","Japan",5,"0",0
"710",1871,"Nissin","Cup Noodles Minced Pork Flavour","Cup","Thailand",3.75,"0",0
"711",1870,"Asia Gold","Instant Noodles With Beef Flavouring","Pack","Hungary",2.75,"0",0
"712",1869,"Nissin","Soba Fried Noodles Chili","Pack","Germany",3.5,"0",0
"713",1868,"Marutai","Kuroma-yu Tonkotsu Kumamoto Ramen","Bowl","Japan",4,"0",0
"714",1867,"Yum Yum","Premier Bowl Instant Noodles Stewed Pork Flavour","Bowl","Thailand",4,"0",0
"715",1866,"MyKuali","Penang Spicy Prawn Soup Noodle","Pack","Malaysia",5,"0",0
"716",1865,"Mama","Shrimp Tom Yum Flavour Cup Noodles","Cup","Myanmar",3.5,"0",0
"717",1864,"Nissin","Raoh Ramen Noodle Soup Umami Tonkotsu Flavor","Pack","USA",5,"0",0
"718",1863,"Baijia","Broad Noodle Pickled Vegetable Artificial Beef Flavor","Pack","China",0,"0",0
"719",1862,"Ibumie","Always Mi Goreng Perisa Asli","Pack","Malaysia",3.75,"0",0
"720",1861,"Conimex","Oriental Noodles Groene Curry","Cup","Netherlands",0.5,"0",0
"721",1860,"Nissin","Cupo Noodle Pasta Style Vongole","Cup","Japan",2.75,"0",0
"722",1859,"Mama","Instant Noodles chicken Green Curry Flavour","Pack","Cambodia",5,"0",0
"723",1858,"Myojo","Wantan Men","Bowl","Japan",5,"0",0
"724",1857,"IbuRamen","Mi Goreng Bento Noodles In A Box Shallot Teriyaki Flavor","Tray","USA",3.25,"0",0
"725",1856,"Indomie","Instant Cup Noodles Mi Goreng Fried Noodles","Cup","Indonesia",5,"0",0
"726",1855,"Daraz","Negi Man Ramen","Pack","Japan",3,"0",0
"727",1854,"Mama","Chinese Kitchen Chinese Style Instant Noodles","Pack","Myanmar",3.5,"0",0
"728",1853,"Bonasia","Instant Noodles Shrimp Flavour","Pack","Hungary",3.5,"0",0
"729",1852,"Myojo","Udon Japanese Style Precooked Noodles With Soup Hot & Spicy Flavor","Bowl","USA",3.25,"0",0
"730",1851,"Fujiwara","Snow Crab Flavour Shio Ramen","Pack","Japan",3.5,"0",0
"731",1850,"Nissin","Raoh Ramen Noodle Soup Umami Miso Flavor","Pack","USA",4.5,"0",0
"732",1849,"Pama","Instant Rice Vermicelli Clear Soup Flavour","Pack","Malaysia",3.5,"0",0
"733",1848,"MyKuali","Penang Red tom Yum Goong Noodle (New Version)","Pack","Malaysia",5,"0",0
"734",1847,"Conimex","Oriental Noodles Hot & Spicy","Pack","Netherlands",3,"0",0
"735",1846,"Nissin","Chow Mein Savory Sauce And Restayrant Quality Noodles Roast Chicken Flavor ","Tray","USA",4.5,"0",0
"736",1845,"Mama","Oriental Style Instant Noodles Shrimp Flavour","Pack","Bangladesh",3.25,"0",0
"737",1844,"Seven & I","Gold Sumire Ramen","Bowl","Japan",5,"0",0
"738",1843,"Forest Noodles","Sunbaked Noodles With Sesame Sauce","Pack","Taiwan",4.5,"0",0
"739",1842,"Forest Noodles","Purple Sweet Potato Noodles With Taiwanese Sauce","Pack","Taiwan",5,"0",0
"740",1841,"Forest Noodles","Sunbaked Noodles With Spicy Sauce","Pack","Taiwan",4,"0",0
"741",1840,"Forest Noodles","Sweet Potato Noodles With Sesame Paste Sauce","Pack","Taiwan",3.25,"0",0
"742",1839,"Vit's","Taste Of Malaysia Penang White Curry Ramen","Pack","Malaysia",5,"0",0
"743",1838,"Vit's","Taste Of Malaysia Penang Asam Laksa Fried Instant Noodle","Pack","Malaysia",4.5,"0",0
"744",1837,"Vit's","Taste Of Malaysia Penang Hokkien Mee Ramen","Pack","Malaysia",5,"0",0
"745",1836,"Vit's","Taste Of Malaysia Penang White Curry Fried Instant Noodle","Pack","Malaysia",5,"0",0
"746",1835,"Vit's","Taste Of Malaysia Penang Asam Laksa Ramen","Pack","Malaysia",5,"0",0
"747",1834,"Vit's","Taste Of Malaysia Penang Hokkien Mee Fried Instant Noodle","Pack","Malaysia",5,"0",0
"748",1833,"Vit's","Instant Noodles With Chicken Flavour","Pack","Malaysia",3.75,"0",0
"749",1832,"Yum Yum","Instant Flat Shaped Noodles Boat Noodles Nam Tok Flavour","Pack","Thailand",3.5,"0",0
"750",1831,"Kuriki","Plum Mayo Ramen","Pack","Japan",4,"0",0
"751",1830,"Tseng Noodles","Sichuan Pepper Flavor","Pack","Taiwan",4.75,"0",0
"752",1829,"Tseng Noodles","Hu Sesame Flavor","Pack","Taiwan",5,"0",0
"753",1828,"Tseng Noodles","Scallion With Sichuan Pepper  Flavor","Pack","Taiwan",5,"2016",9
"754",1827,"Nongshim","Zha Wang ((Jjawang) Noodles With Chajang Sauce","Pack","South Korea",5,"0",0
"755",1826,"Mama","Instant Noodles Stewed Beef Flavour","Pack","Cambodia",3.5,"0",0
"756",1825,"Sichuan Baijia","Broad Noodle Chilli Oil Flavor","Pack","China",4.5,"0",0
"757",1824,"Nongshim","Soon Veggie Noodle Soup","Cup","USA",5,"0",0
"758",1823,"MyKuali","MeeKuali spicy Fried Noodle","Pack","Malaysia",4,"0",0
"759",1822,"Mi Sedaap","Mi Kuah Rasa Baso Spesial","Pack","Indonesia",3.5,"0",0
"760",1821,"Myojo","Udon Japanese Style Pre-Cooked Noodles With Soup Beef Flavor","Bowl","USA",3.25,"0",0
"761",1820,"Ten-In","Veggie King Buddha Jump Instant Noodles","Bowl","Taiwan",1.5,"0",0
"762",1819,"Yum Yum","Premier Bowl Instant Noodles Suki Flavour","Bowl","Thailand",5,"0",0
"763",1818,"Sugakiya Foods","Nara Tenri Shoyu Ramen","Bowl","Japan",4.5,"0",0
"764",1817,"Hao Way","Penang Vegetarian Prawn Instant Bowl Noodles","Bowl","Malaysia",4,"0",0
"765",1816,"Vifon","Asian Style Instant Noodles Artificial Beef Flavor","Bowl","Vietnam",3.25,"0",0
"766",1815,"Nakaya Shouten","Hingya no Shio Ramen","Pack","Japan",4,"0",0
"767",1814,"Koh Thai","Island Of Flavours Tom Yum Instant Noodles Soup","Pack","Netherlands",3,"0",0
"768",1813,"Nissin","Soba Fried Noodles Curry","Pack","Germany",4.25,"0",0
"769",1812,"Master Kong","Mushroom Instant Noodle","Bowl","China",4.25,"0",0
"770",1811,"Conimex","Oriental Noodles Oosterse Groenten","Pack","Netherlands",3.5,"0",0
"771",1810,"MyKuali","Penang White Curry Noodle (New Version)","Pack","Malaysia",5,"0",0
"772",1809,"Marutai","Nagahama Hakata Tonkotsu Ramen","Bowl","Japan",4.75,"0",0
"773",1808,"Mama","Vegetarian Instant Cup Noodle Tofu & Shiitake Flavour","Cup","Thailand",3.5,"0",0
"774",1807,"Wai Wai","Tom Yum Goong Flavour Instant Noodle","Cup","Thailand",3.5,"0",0
"775",1806,"Cintan","Mi Segera Mmm... Perisa Goreng Ala Indonesia","Pack","Malaysia",3.5,"0",0
"776",1805,"Mama","Oriental Style Instant Noodles Tandoori Flavour","Pack","Bangladesh",4,"0",0
"777",1804,"Thai Chef","Oriental Style Instant Noodles Shrimp Creamy Tom Yum Flavour","Pack","Hungary",4.75,"0",0
"778",1803,"Mama","Vegetarian Instant Noodles Tom Yum Flavour","Pack","Thailand",4,"0",0
"779",1802,"Nissin","Cup Noodles Ramen Noodles Ramen Noodle Soup Beef Flavor (New Package) ","Cup","USA",3.5,"0",0
"780",1801,"Baijia","Spicy Artificial Fei Chang Instant Vermicelli (New Recipe)","Pack","China",3.75,"0",0
"781",1800,"Crystal Noodle","Soup All Natural Hot & Sour","Cup","USA",0.25,"0",0
"782",1799,"Thai Smile","Spring Onion Rice Noodle Soup Bowl","Bowl","USA",2.5,"0",0
"783",1798,"iMee","Instant Noodles Vegetable Flavour","Pack","Netherlands",2.75,"0",0
"784",1797,"Wai Wai","Instant Rice Vermicelli Crab Flavour","Pack","Thailand",3.5,"0",0
"785",1796,"Fujiwara","Salty Taste Chanko Noodle","Pack","Japan",4.75,"0",0
"786",1795,"Azami","Kimchee Flavour Noodle Soup","Pack","Canada",0,"0",0
"787",1794,"Vit's","Shallot Chicken Instant Noodles","Pack","Malaysia",3,"0",0
"788",1793,"Cintan","Mi Segera Mmm... Perisa Asam Laksa","Pack","Malaysia",3.5,"0",0
"789",1792,"A1","Soup Spices Noodle Mee Rempahan Sup","Pack","Malaysia",3.5,"0",0
"790",1791,"Vit's","Tom Yam Instant Noodles","Pack","Malaysia",4.25,"0",0
"791",1790,"Super","Kimchi","Cup","Malaysia",4.5,"0",0
"792",1789,"Cintan","Mi Segera Mmm... Perisa Ayam Cendawan","Pack","Malaysia",3.5,"0",0
"793",1788,"Super","Curry Flavour Noodles","Cup","Malaysia",3,"0",0
"794",1787,"Pama","Kua Teaw Segera","Pack","Malaysia",4,"0",0
"795",1786,"Nissin","Chow Mein Premium Savory Sauce And Restaurant Quality Noodles Sriracha Flavor","Tray","USA",4.25,"0",0
"796",1785,"Super","Instant Noodles Black Pepper Crab Mi Goreng","Cup","Malaysia",3.5,"0",0
"797",1784,"Torishi","Hakata Tonkotsu Ramen","Pack","Japan",5,"0",0
"798",1783,"iMee","Instant Noodles Creamy Tom Yum Shrimp Flavour","Pack","Netherlands",4.5,"0",0
"799",1782,"Western Family","Beef Flavour Instant Noodles","Pack","Canada",0,"0",0
"800",1781,"MyKuali","Penang Hokkien Prawn Soup Rice Vermicelli (Bihun)","Bowl","Malaysia",5,"0",0
"801",1780,"Pulmuone","Non-Fried Noodle Blackbean Sauce Noodle With Squid","Pack","South Korea",4.5,"0",0
"802",1779,"Chering Chang","Instant Non-Fried Noodles Tomato Flavour","Pack","Taiwan",3.25,"0",0
"803",1778,"JML","Spicy King Spicy Chicken","Pack","China",5,"0",0
"804",1777,"JML","Supereme Bowl Noodles With Stewed Egg Spicy Flavour","Bowl","China",3.5,"0",0
"805",1776,"JML","Spicy King Bowl Noodle Spicy Chicken","Bowl","China",5,"0",0
"806",1775,"JML","Spicy King Bowl Noodle Spicy Beef","Bowl","China",4.25,"0",0
"807",1774,"JML","Spicy King Spicy Pork","Pack","China",5,"0",0
"808",1773,"JML","Supreme Bowl Noodles With Stewed Egg Sour Beans With Pork Flavour","Bowl","China",4,"0",0
"809",1772,"JML","Spicy King Spicy Beef","Pack","China",5,"0",0
"810",1771,"JML","Supreme Bowl Noodles With Stewed Egg Braised Beef Flavour","Bowl","China",3.5,"0",0
"811",1770,"JML","Spicy King Bowl Noodle Spicy Pork","Bowl","China",4.5,"0",0
"812",1769,"Mamee","Chef Lontong Flavour","Pack","Malaysia",5,"0",0
"813",1768,"New Touch","Negi Miso No Ippin Ramen","Bowl","Japan",5,"0",0
"814",1767,"Mama","Instant Noodles Shrimp Tom Yum Flavour","Pack","Cambodia",4,"0",0
"815",1766,"Paldo","Bulnak Boeummyun King Noodle","Bowl","South Korea",3.5,"0",0
"816",1765,"Nissin","Cup Noodles Ramen Noodles With Shrimp (New Package) ","Cup","USA",3.5,"0",0
"817",1764,"Pirkka","Nuudeli Tom Yum Katkarapu","Pack","Finland",3.75,"0",0
"818",1763,"Ishimaru","Tuna Flavor Ramen","Pack","Japan",4.5,"0",0
"819",1762,"Mom's Dry Noodle","Sesame & Pepper","Pack","Taiwan",4,"0",0
"820",1761,"Authentically Asian","Natural Quality Foods Pad Thai Noodle Bowl","Bowl","USA",1,"0",0
"821",1760,"New Touch","Homestyle Tonjiru","Bowl","Japan",4.5,"0",0
"822",1759,"Nissin","Cup Noodles Moo Manao Flavour","Cup","Thailand",4,"0",0
"823",1758,"Vit's","Duck Instant Noodles","Pack","Malaysia",3.5,"0",0
"824",1757,"iMee","Instant Noodles Beef Flavour","Pack","Netherlands",3.25,"0",0
"825",1756,"A-Sha Dry Noodle","Veggie Noodle Carrot Noodle With Original Sauce","Pack","Taiwan",4.25,"0",0
"826",1755,"Mama","Oriental Style Instant Noodles Hot & Spicy Flavour","Pack","Bangladesh",4,"0",0
"827",1754,"Paldo","King Bowl Super Spicy Pan Stirfried Noodle","Bowl","South Korea",5,"0",0
"828",1753,"Thai Smile","Garlic Rice Noodle Soup Bowl","Bowl","USA",3.5,"0",0
"829",1752,"Kuriki","Mayo Ramen","Pack","Japan",4.75,"0",0
"830",1751,"Mom's Dry Noodle","Spicy & Sour Flavor","Pack","Taiwan",5,"0",0
"831",1750,"Mi Sedaap","Instant Cup Mi Kuah Rasa Soto","Cup","Indonesia",5,"0",0
"832",1749,"Yum Yum","Jumbo Instant Noodles Tom Yum Kung Creamy Flavour","Pack","Thailand",5,"0",0
"833",1748,"Azami","Chili Chicken Flavour Noodle Soup","Cup","Canada",3,"0",0
"834",1747,"Vit's","Curry Instant Noodles","Pack","Malaysia",3.5,"0",0
"835",1746,"Marutai","Ramen Shoyu Taste","Bowl","Japan",4.25,"0",0
"836",1745,"Unox","Good Noodles Kerrie","Pack","Netherlands",3.5,"0",0
"837",1744,"A-Sha Dry Noodle","Veggie Noodle Baby Grass Noodle With Toona Sauce","Pack","Taiwan",5,"0",0
"838",1743,"Mama","Rangers Snack Noodles Shrimp Tom Yum Flavour","Pack","Myanmar",4.5,"0",0
"839",1742,"Aroi","Curry Me! Penang White Curry Stir-fry Noodle","Pack","Malaysia",4.5,"0",0
"840",1741,"Myojo","Udon Japanese Style Pre-Cooked Noodles With Soup Chicken Flavor","Bowl","USA",2.5,"0",0
"841",1740,"Master Kong","Braised Beef Noodle","Pack","China",4.25,"0",0
"842",1739,"Nissin","Raoh Tanrei Koku Shio Ramen","Bowl","Japan",4.5,"0",0
"843",1738,"Little Cook","Instant Noodles Shrimp Tom Yum Flavour","Cup","Thailand",4.25,"0",0
"844",1737,"Mi Sedaap","Instant Cup Mi Goreng","Cup","Indonesia",3.75,"0",0
"845",1736,"Mamee","Monster Snek Mi Pedas","Pack","Malaysia",5,"0",0
"846",1735,"Master Kong","Tomato Sauce Instant Noodle","Bowl","China",4,"0",0
"847",1734,"Koka","Laksa Singapura","Pack","Singapore",4.25,"0",0
"848",1733,"Bonasia","Instant Noodles Beef Flavour","Pack","Germany",3.75,"0",0
"849",1732,"Super","Seafood Flavour Noodles","Cup","Malaysia",3.25,"0",0
"850",1731,"Mama","Instant Noodles Creamy Shrimp Tom Yum Flavour","Pack","Cambodia",5,"0",0
"851",1730,"Wu-Mu","BBQ Pork Flavor Chow Mein","Pack","Taiwan",4.5,"0",0
"852",1729,"Vedan","Zan Vegetarian Instant Noodle Series Shiitake Mushroom Flavour","Cup","Taiwan",2.75,"0",0
"853",1728,"Yamadai","Tenobe Somen","Bowl","Japan",3.25,"0",0
"854",1727,"Wei Lih","Jah Jan Men","Bowl","Taiwan",5,"0",0
"855",1726,"Vina Acecook","Oh! Ricey Pho Ga","Bowl","Vietnam",3,"0",0
"856",1725,"A-Sha Dry Noodle","Veggie Noodle Black Sesame Noodle","Pack","Taiwan",3.25,"0",0
"857",1724,"Pirkka","Nuudeli Liha Nudlar Kott","Pack","Finland",3.5,"0",0
"858",1723,"Baixiang Noodles","Artificial Beef Instant Noodles With Soup Base","Pack","China",3.75,"0",0
"859",1722,"CarJEN","Otentiq Cheezy Curry Instant Noodles","Pack","Malaysia",4.5,"0",0
"860",1721,"Salam Mie","Mi Goreng Dengan Abon","Pack","Indonesia",4.25,"0",0
"861",1720,"Mamee","Chef Lontong Flavour","Cup","Malaysia",5,"0",0
"862",1719,"Wai Wai","Grilled Pork Flavour Instant Noodles","Bowl","Thailand",2.5,"0",0
"863",1718,"Vina Acecook","Hao Hao Sate Onion Flavour","Cup","Vietnam",2.5,"0",0
"864",1717,"Lee Fah Mee","Sarawak White Laksa Instant Noodle","Pack","Sarawak",4,"0",0
"865",1716,"Mama","Instant Noodles Egg Protein Noodles","Pack","Myanmar",3.5,"0",0
"866",1715,"Yum Yum","Instant Noodles Minced Pork Flavor","Pack","Thailand",3.75,"0",0
"867",1714,"Master Kong","Sichuan Hot Spicy Fish","Pack","China",3.75,"0",0
"868",1713,"CarJEN","Otentiq Cheezy Mushroom Instant Noodles","Pack","Malaysia",5,"0",0
"869",1712,"Sakurai Foods","Organic Miso Ramen","Pack","Japan",4.5,"0",0
"870",1711,"Hao Way","Vegetarian Penang Laksa","Pack","Malaysia",4,"0",0
"871",1710,"Chering Chang","Instant Non-Fried Noodles Vegetable Curry Flavor","Pack","Taiwan",5,"0",0
"872",1709,"Asia Gold","Instant Noodles With Shrimp Flavouring","Pack","Hungary",4,"0",0
"873",1708,"The Kitchen Food","Sibu Instant Kampua Original","Pack","Sarawak",4,"0",0
"874",1707,"Azami","Hot & Spicy Flavour Noodle Soup","Bowl","Canada",3.5,"0",0
"875",1706,"Maggi","Hot Cup Goreng Perencah Cili Fiesta","Cup","Malaysia",4.75,"0",0
"876",1705,"Premiere","Gold Bihun Kari Heritage Instant Rice Vermicelli","Pack","Malaysia",4.5,"0",0
"877",1704,"Baixiang Noodles","Sour & Spicy Flavour","Pack","China",3.75,"0",0
"878",1703,"7 Select/Nissin","Super Tom Yum Shrimp","Cup","Thailand",3.5,"0",0
"879",1702,"Samyang Foods","Seafood Noodle","Cup","Japan",2.75,"0",0
"880",1701,"Sakurai Foods","Organic Shoyu Ramen","Pack","Japan",4.25,"0",0
"881",1700,"A-Sha Dry Noodle","Hakka Flat Noodle With Za Jiang Sauce","Pack","Taiwan",4,"0",0
"882",1699,"Vit's","Mi goreng Pedas Chewy & springy","Pack","Malaysia",3.5,"0",0
"883",1698,"Maruchan","Instant Lunch Chicken Tortilla Flavor Ramen Noodles With Vegetables","Cup","USA",4,"0",0
"884",1697,"The Kitchen Food","Instant Kampua Dark Soy Sauce","Pack","Sarawak",5,"0",0
"885",1696,"Mama","Cup Yentafo Tom Yum Mohfai","Cup","Thailand",5,"0",0
"886",1695,"Mama","Cup Shrimp Creamy Tom Yum","Cup","Thailand",5,"0",0
"887",1694,"Mama","Instant Rice Vermicelli Bihun Goreng Original Flavour","Pack","Thailand",4.75,"0",0
"888",1693,"Mama","Instant Noodles coconut Milk Flavour","Cup","Myanmar",5,"0",0
"889",1692,"Mama","Oriental Style Instant Noodles Chicken Flavour","Pack","Bangladesh",3.25,"0",0
"890",1691,"Mama","Instant Cup Noodles Minced Prok Flavor","Cup","Thailand",3.5,"0",0
"891",1690,"Wugudaochang","Sour Bamboo Shoot & Beef If Hot Pot Flavor Noodles","Bowl","China",4,"0",0
"892",1689,"Wugudaochang","Tomato Beef Brisket Flavor Purple Potato Noodle","Pack","China",5,"2016",7
"893",1688,"Wugudaochang","Sea Tangle & Sparerins Flavor Noodles","Bowl","China",3.75,"0",0
"894",1687,"Wugudaochang","Chef's Grains Millet Noodle","Pack","China",3.75,"0",0
"895",1686,"Wugudaochang","Chef's Grains Buckwheat Noodle","Pack","China",3.5,"0",0
"896",1685,"Wugudaochang","Chef's Grains Pea Noodle","Pack","China",4,"0",0
"897",1684,"Wugudaochang","Sichuan Pepper & Chicken Flavor Noodle","Bowl","China",4.5,"0",0
"898",1683,"Wugudaochang","Sour Soup & Minced Meat Flavor Chef's Grain Naked Oat Noodles","Pack","China",5,"0",0
"899",1682,"Wugudaochang","Sour Bamboo Shoot & Beef If Hot Pot Flavor Noodles","Pack","China",4,"0",0
"900",1681,"Wugudaochang","Sea Tangle & Sparerins Flavor Noodles","Bowl","China",3.75,"0",0
"901",1680,"Aroi","Curry Me! Penang White Curry Soup Noodle","Pack","Malaysia",4.5,"0",0
"902",1679,"Ten-In","Veggie World Vegetarian Braised Beef Instant Noodles","Bowl","Taiwan",3.5,"0",0
"903",1678,"Nongshim","Shin Black Spicy Po-Au-Feu Flavor (Mew Edition)","Pack","USA",5,"0",0
"904",1677,"Paldo","Raobokki Noodle (Export Version)","Pack","South Korea",5,"0",0
"905",1676,"A1","Emporer Herbs Chicken Noodle","Pack","Malaysia",4.25,"0",0
"906",1675,"Baixiang Noodles","Sauerkraut Flavor","Pack","China",4.5,"0",0
"907",1674,"Emart","Dare You! Habanero Ramen (New Edition)","Cup","South Korea",3.5,"0",0
"908",1673,"Lishan Food Manufacturing","Black Cock Brand Vegetarian Chicken Noodle","Pack","Taiwan",3.5,"0",0
"909",1672,"Azami","Chili Seafood Flavor Noodle Soup","Cup","Canada",3.25,"0",0
"910",1671,"Ah Lai","Penang Favourite White Curry Rice Vermicelli","Pack","Malaysia",5,"0",0
"911",1670,"Tropicana Slim","Less Fat Noodles Grilled Chicken","Pack","Indonesia",3.75,"0",0
"912",1669,"A-One","Mi Ly Instant Noodles Mi Chay Vegetarian Flavor","Cup","Vietnam",1.25,"0",0
"913",1668,"Mama","Cup Rice Vermicelli With Clear Soup","Cup","Thailand",3.5,"0",0
"914",1667,"Deshome","Aloe Thin Noodles With Camelia Oil Vegetable Sauce Flavor","Pack","Taiwan",5,"0",0
"915",1666,"Vifon","Curry Instant Noodle With Chicken","Cup","Vietnam",3,"0",0
"916",1665,"Paldo Vina","Koreno Premium Mushroom Flavor","Pack","Vietnam",1.5,"0",0
"917",1664,"Mamee","Oriental Noodles Prawn Flavor","Pack","Malaysia",2,"0",0
"918",1663,"Vina Acecook","King Chef Authentic Kimchi Flavour","Pack","Vietnam",4,"0",0
